"id","ruc","razon_social","departamento","provincia","distrito","direccion","monto","estado","created_at","updated_at"
"164","20517222560","CORPORACION LON SOCIEDAD ANONIMA CERRADA - CORPOLON S.A.C.","LIMA","LIMA","LURIN","AV. LOS EUCALIPTOS NRO. S/N INT. 58 Z.I. SECTOR SANTA GENOVEVA - PARCELA 10",,,,
"165","20536727524","COSTEÑO ALIMENTOS S.A.C.","LIMA","LIMA","MAGDALENA DEL MAR","JR. CONTRALMIRANTE MONTERO NRO. 429 INT. 301",,,,"2025-07-25 18:01:17"
"166","20517842517","ALIMENTOS CIELO SOCIEDAD ANONIMA CERRADA - ALI CI S.A.C.","LIMA","LIMA","LURIGANCHO","MZA. F LOTE. 5 LOT. PRE URBANA NIEVERIA (ESPALDA FABRICA LECHE GLORIA)",,,,
"167","20100376203","AGROINDUSTRIAS INTEGRADAS S A","LIMA","LIMA","LOS OLIVOS","AV. ANGELICA GAMARRA NRO. 870 URB. EL TREBOL (MERCADO DE CAQUETA)",,,,
"168","20612220761","ROMA LT DISTRIBUIDORA SOCIEDAD ANONIMA CERRADA","HUANUCO","HUANUCO","AMARILIS","AV. JOSE CARLOS MARIATEGUI NRO. 315",,,,"2024-11-21 15:21:47"
"169","20601598567","GRUPO DICOS S.R.L.","APURIMAC","ABANCAY","ABANCAY","AV. JORGE CHAVEZ MZA. E LOTE. 05 URB. URB. CASCO URBANO (ENTRADA ALTIPUERTO - 1ER PISO)",,,,
"170","20611458259","DISTRIBUIDORA 4R S.A.C.","ICA","ICA","ICA","AV. SANTANA CHIRI NRO. F-19 INT. F-19 URB.",,,,
"171","20394046648","CG DISTRIBUCIONES S.R.L.","UCAYALI","CORONEL PORTILLO","CALLERIA","JR. ABRAHAM VALDELOMAR MZA. SN LOTE. B2-3 URB. GALPESA",,,,
"172","20602215122","LABORATORIO MUNDO MEDIC SOCIEDAD ANONIMA CERRADA - LABORATORIO MUNDO MEDIC S.A.C.","LIMA","LIMA","SAN MARTIN DE PORRES","MZA. A LOTE. 1 INT. 301 APV. SANTA TERESA (TERCER PISO)",,,,
"173","20556497312","INDUSTRIA ALIMENTOS Y SERVICIOS GEDUAL E.I.R.L.","LORETO","MAYNAS","IQUITOS","JR. RAIMONDI NRO. 220 (A 2 CUADRAS DE LA PLAZA DE ARMAS DE IQUI)",,,,
"174","20468862086","COMERCIAL ISABELITA S.A.C.","LIMA","LIMA","PUENTE PIEDRA","AV. INDUSTRIAL NRO. 321 URB. LOTIZACION LAS VEGAS- I ETAPA (ALTURA KM 30 PANAMERICANA NORTE)",,,,
"175","20610063382","CORPORACION SILKAY S.A.C.S.","HUANCAVELICA","HUANCAVELICA","HUANCAVELICA","AV. AUGUSTO B. LEGUIA NRO. 112 C.P. HUANCAVELICA",,,,
"176","20610409793","GRUPO ALPONY E.I.R.L.","CUSCO","ANTA","ANCAHUASI","NRO. SN C.C. SAN RAFAEL",,,,
"177","20103129061","COMERCIAL LAVAGNA S.A.C","LAMBAYEQUE","CHICLAYO","PIMENTEL","CAL.PARQUE INDUSTRIAL MZA. E LOTE. 4 Z.I. PARQUE INDUSTRIAL",,,,"2025-02-11 17:09:35"
"178","20612950076","GRUPO KADENA CHANCHAMAYO S.A.C.","JUNIN","CHANCHAMAYO","CHANCHAMAYO","AV. JOSE DE SAN MARTIN MZA. C INT. L-05 URB. SAN CARLOS (AL COSTADO DE HOSPEDAJE PEQUEÑITO)",,,,
"179","20610192671","GRUPO CARRANZA R & E CHOTA S.R.L.","CAJAMARCA","CHOTA","CHOTA","KM. 151 CAS. PINGOBAMBA (CART.CHICLAYO CHOTA A 200M GRIFO RESEPSO)",,,,
"180","20611097515","CABMET PERU S.A.C.","LIMA","LIMA","CARABAYLLO","MZA. A LOTE. 3 ASC. DE PROP EL REMANZO CARABAYLLO",,"1",,"2025-01-29 23:02:11"
"181","20606709286","SUPERMERCADOS SUPER SOL SOCIEDAD ANONIMA CERRADA","LIMA","LIMA","SAN JUAN DE MIRAFLORES","MZA. D LOTE. 14 A.H. VICTOR HAYA DE LA TORRE",,,,
"182","20603253486","Distribuidora e inversiones ANDERSON sac.","CUSCO",,,,,,,
"183","20112273922","TIENDAS DEL MEJORAMIENTO DEL HOGAR S.A","LIMA","LIMA","SURQUILLO","AV. ANGAMOS ESTE NRO. 1805 INT. 2 (OFICINA 2)",,,,
"184","20609883562","KANTU CONSUMO SOCIEDAD ANONIMA CERRADA","PUNO","SAN ROMÁN","JULIACA","JR. 20 DE ENERO MZA. C LOTE. 2 URB. TAPARACHI",,,,"2025-03-06 19:48:29"
"185","20611043873","GRUPO ECOLIMP E.I.R.L","JUNIN","HUANCAYO","HUANCAYO","JR. JOSE GALVEZ BARRENECHEA NRO. 117 DPTO. 302",,,,
"186","20611341548","INVERSIONES DARYAL S.A.C.","LIMA","LIMA","CARABAYLLO","AV. PERIMETRICA SAN LORENZO MZA. B LOTE. 2 ASC. ASOC. VIV. LOS NARANJITOS",,,,
"187","20376113443","EUROTUBO S.A.C.","LIMA","LIMA","LINCE","JR. CORONEL. DOMINGO CASANOVA NRO. 190 DPTO. 201 URB. FUNDO LOBATÓN",,,,
"188","20612444961","JOSELYN & PIERO DISTRIBUCIONES E.I.R.L.","MOQUEGUA","MOQUEGUA","ILO","MZA. 31 LOTE. 19 OTR. PMV. III LAS BRISAS (PAMPA INALAMBRICA)",,,,
"189","20612449202","COMERCIALIZADORA CODISAL S.A.C.","LIMA","LIMA","SANTIAGO DE SURCO","AV. MANUEL OLGUIN NRO. 375 INT. 1001",,,,
"190","20609361582","GRUPO INVERCOM PERU E.I.R.L.","LIMA","LIMA","VILLA EL SALVADOR","CAL.SECTOR 6 MZA. L LOTE. 1 SEC. GRUPO 5",,,,
"191","20609558114","NEW PLAY SHOP S.A.C.","LIMA","LIMA","LOS OLIVOS","AV. UNIVERSITARIA NRO. 2764 COO. PUEBLO LIBRE",,,,
"192","2012265000603","IMPORTACIONES CARMELITA DEL NORTE SOCIEDAD ANONIMA CERRADA","LIMA","LIMA","LIMA","JR. CUZCO NRO. 809A",,,,
"193","20612449202","COMERCIALIZADORA CODISAL S.A.C.","LIMA","LIMA","LIMA","AV. MANUEL OLGUIN NRO. 375 INT. 1001",,,,
"194","CHIPANA TICONA DUHANER","CHIPANA TICONA DUHANER",,,,"PASEO DE LOS HEROES MANAZA 536 LOTE 17",,,,
"195","20555472111","PLASTICOS GONZALES S.A.C.","LIMA","LIMA","LA VICTORIA","AV. AVIACION NRO. 485",,,,
"196","20601667852","INVERSIONES CFC S.A.C.","TACNA","TACNA","TACNA","CAL.FRANCISCO CORNEJO NRO. 851 (MEDIA CUADRA DE UNIVERSIDAD)",,,,
"197","20612770361","AMADECOR IMPORT S.A.C.","LIMA","LIMA","LIMA","AV. REPUBLICA DE ARGENTINA NRO. 240 URB. LIMA INDUSTRIAL",,,,
"198","20553102546","TRIOPLAST S.A.C.","LIMA","LIMA","LURIN","MZA. U LOTE. 74 URB. LAS PRADERAS DE LURIN (A ESPALDAS DEL PARQUE MIGUEL GRAU)",,,,
"199","20602225446","SHELLCON E.I.R.L","CALLAO","PROV. CONST. DEL CALLAO","CARMEN DE LA LEGUA REYNOSO","AV. JOSE LOPEZ PAZOS NRO. 947 P.J. REYNOSO (A MEDIA CUADRA DEL PARQUE MIGUEL GRAU)",,,,
"200","20392846345","COMERCIALIZADORA Y DISTRIBUIDORA ANITA S.A.C","LIMA","LIMA","SAN JUAN DE LURIGANCHO","JR. LAS GETIAS MZA. A LOTE. 42 URB. LAS FLORES 78 (ALT. PARADERO 12 PROCERES DE LA INDEPEND)",,,,
"201","20603743874","C & J DISTRIBUCIONES MADRE DE DIOS SOCIEDAD ANONIMA CERRADA","MADRE DE DIOS","TAMBOPATA","TAMBOPATA","JR. ATAHUALLPA MZA. D LOTE. 1 (POR EL TERMINAL TERRESTRE)",,,,
"202","20601786355","IQ APOR E.I.R.L.","AYACUCHO","HUAMANGA","AYACUCHO","JR. ARGENTINA NRO. 248 (A MEDIA CUADRA DEL ARCO PUCA CRUZ)",,,,
"203","20610397809","LEIMPORT EXPORT S.A.C.","LIMA","LIMA","SANTA ANITA","AV. CARRETERA CENTRAL NRO. 341 FND. INQUISIDOR Y PULIDO",,,,
"204","10452029214","HUAMANI AMACHI ROBERTO HUGO","LIMA","LIMA","LA VICTORIA","JR.	HIPÓLITO UNANUE	1707",,,,
"205","20486379066","GRUPO GRANDE S.A.C.","LIMA","LIMA","LA VICTORIA","AV. MEXICO NRO. 760 (CUADRA 7 DE MEXICO)",,,,
"206","20600021908","CORPORATIVO DE COMERCIO E INVERSIONES S.A.C.","LIMA","LIMA","LA VICTORIA","CANGALLO NRO. 930",,,,
"207","20610900845","DISTRIBUIDORA HERPOR S.A.C.","LIMA","LIMA","LOS OLIVOS","MZA. U LOTE. 6 INT. 1 URB. VIRGEN DE FATIMA",,,,"2025-09-02 16:49:51"
"208","20614189798","CARRANZA R Y E CHOTA S.R.L.","CAJAMARCA","CHOTA","CHOTA","KM. 151 CAS. PINGOBAMBA (CART.CHICLAYO CHOTA A 200M GRIFO RESEPSO)",,,,
"209","20479504068","SIPAN DISTRIBUCIONES SOCIEDAD ANONIMA CERRADA","LAMBAYEQUE","CHICLAYO","LA VICTORIA","CAR.NUEVA MONSEFU KM. 2.7 SEC. CHACUPE (AL COSTADO MOLINO NUEVO HORIZONTE)",,,,
"210","20516045397","TAMBOS PERU S.A.C. - TAMPESAC","LIMA","LIMA","PUENTE PIEDRA","CAL.SIETE MZA. C-1 LOTE. 11 URB. LAS VEGAS",,,,
"211","20289907743","ILKO PERU S.A.C.","LIMA","LIMA","SAN ISIDRO","AV. REPUBLICA DE COLOMBIA NRO. 717 INT. 701 (INTERIOR 701 B-C)",,,,
"212","10479799488","CARRANZA TOCTO RONALD - INVERSIONES ROMAX PERÚ NORT",,,,,,,,
"213","00000000000","WALTER CRUZ HUAMAN - PROVEEDOR PRIVADO","APURIMAC","ANDAHUAYLAS","HUANCARAMA","JR. LA LIBERTAD S/N",,,,"2025-10-22 21:58:45"
"214","10701987506","CONDORI HUASCO CALEF","APURIMAC","ANDAHUAYLAS","HUANCARAMA","JR. LIBERTAD S/N",,,,
"215","20602845118","CORPORACION MAMITA E.I.R.L.","ANCASH","HUARAZ","INDEPENDENCIA","OTR.CASERIO DE HUACRAJIRCA NRO. SN C.P. HUANCHAC (PASANDO UNA CUADRA DEL RECREO EL BOSQUE)",,,,
"216","20606979780","METALE CONEXIONES S.R.L.","LIMA","LIMA","SANTA ANITA","CAL.TRABAJO NRO. 186",,,,
"217","20558614120","CMS DEL SUR S.A.C.","TACNA","TACNA","TACNA","MZA. E LOTE. 11B Z.I. PARQUE INDUSTRIAL (A MEDIA CUADRA DE FERRETERIA HELEO)",,,,
"218","20100067839","TUBOPLAST S A","LIMA","LIMA","ATE","CAL.MARIE CURIE NRO. 313 Z.I. SANTA ROSA",,,,
"219","20100553423","INYECTOPLAST S A","LIMA","LIMA","LIMA","CAL.SULLANA NRO. 1882 URB. CHACRA RIOS NORTE (PARALELA A LA PROLONGACION ARICA)",,,,
"220","20519633001","IMPORT EXPORT YOMAR S.A.C.","LIMA","LIMA","LURIGANCHO","AV. 5TA AVENIDA NRO. 290 URB. LA CAPITANA (ALTURA UNIVERSIDAD TELESUP)",,,,
"221","20494328799","JRC DISTRIBUIDOR E.I.R.L.","ICA","NASCA","NASCA","CAL.SAN ISIDRO NRO. 191 FND. CARCELEN (ESPALDA DE COMISARIA-CASA PORTON ROJO)",,,,
"222","20608074164","VENTURA DISTRIBUIDORA E.I.R.L.","ICA","PISCO","PISCO","PJ. LOS LIRIOS NRO. 121",,,,
"223","20538686906","MAGINSA INDUSTRIAL S.A.C.","LIMA","LIMA","PUENTE PIEDRA","OTR.ASOC. PEQ. AVICULTORES MZA. V LOTE. 01 ASC. ADV. ZONA 01 SECTOR 13 U.C. 11285 (ALT. KM. 35.5 PANAMERICANA NORTE)",,,,
"224","20613909410","CONEXUS S.A.C.","Lima","Lima","Villa el Salvador",,,,,
"225","20554032282","PLASTICOS ROCA S.A.C.","PROV. CONST. DEL CALLAO","PROV. CONST. DEL CALLAO","CARMEN DE LA LEGUA REYNOSO","AV. JOSE LOPEZ PASOS NRO. 943 URB. REYNOSO (A 1/2CDRA DE LA PLAZA MIGUEL GRAU)",,,,
"226","20100128056","SAGA FALABELLA S A","LIMA","LIMA","SAN ISIDRO","AV. PASEO DE LA REPUBLICA NRO. 3220 URB. JARDIN",,,,
"227","20600120299","GRUPO M & M TRADING S.A.C.","LIMA","LIMA","LA VICTORIA","PJ. LOS MANZANOS NRO. 144 URB. SAN PABLO (PISO 2 Y 3)",,,,
